{
  "contract_id": "HD-TD-2026-004",
  "contract_type": "thuê kênh truyền dẫn quốc tế",
  "effective_date": "2026-06-01",
  "expiry_date": "2028-05-31",
  "contract_value": {
    "amount": 4800000000.0,
    "currency": "VNĐ",
    "payment_terms": "Thanh toán hàng tháng: 400.000.000 VNĐ. Thanh toán trong vòng 15 ngày kể từ ngày nhận hóa đơn."
  },
  "scope": "Bên B cung cấp cho Bên A dịch vụ thuê kênh truyền dẫn quốc tế với thông số kỹ thuật:\n- Băng thông: 10 Gbps STM-64\n- Tuyến: Hồ Chí Minh — Singapore (qua cáp quang biển APG)",
  "sla": {
    "uptime_commitment": "99.99%",
    "scope": "Thời gian sẵn sàng — Uptime SLA: Mục tiêu: 99.99% (tối đa 52.56 phút ngừng dịch vụ/năm); RTO < 4 giờ; RPO < 1 giờ"
  },
  "penalty_clause": "Nếu Bên B không đạt SLA uptime 99.99%: phạt 0.1% giá trị hợp đồng hàng tháng cho mỗi phút ngừng dịch vụ vượt quá mức cho phép, tối đa phạt không quá 25% giá trị hợp đồng hàng tháng. Nếu Bên B không khôi phục sự cố trong RTO 4 giờ: phạt thêm 50.000.000 VNĐ cho mỗi giờ vượt RTO, không giới hạn mức phạt RTO. Nếu Bên A chậm thanh toán: phạt 0.05% giá trị chưa thanh toán cho mỗi ngày chậm.",
  "penalty_amount": "Đối với Bên B: Phạt 0.1% giá trị hợp đồng hàng tháng cho mỗi phút ngừng dịch vụ vượt (tối đa 25% giá trị hợp đồng hàng tháng); Phạt thêm 50.000.000 VNĐ cho mỗi giờ vượt RTO (không giới hạn). Đối với Bên A: Phạt 0.05% giá trị chưa thanh toán cho mỗi ngày chậm.",
  "auto_renewal": true,
  "renewal_notice_period": "trước 90 ngày",
  "confidentiality": {
    "duration": "3 năm sau khi hợp đồng hết hạn",
    "scope": "Dữ liệu lưu lượng truyền dẫn, thông tin khách hàng, cấu hình kỹ thuật; Báo cáo hiệu suất và SLA"
  },
  "liability_cap": "không vượt quá giá trị hợp đồng của 03 tháng",
  "dispute_resolution": "Mọi tranh chấp phát sinh sẽ được giải quyết qua thương lượng trong 30 ngày. Nếu không đạt, tranh chấp sẽ được đưa ra Trọng tài thương mại TP. HCM.",
  "source_evidence": [
    {
      "field": "contract_id",
      "quote": "Số: HD-TD-2026-004",
      "section": "Header"
    },
    {
      "field": "contract_type",
      "quote": "Bên B cung cấp cho Bên A dịch vụ thuê kênh truyền dẫn quốc tế với thông số kỹ thuật:",
      "section": "ĐIỀU 1: ĐỐI TƯỢNG HỢP ĐỒNG"
    },
    {
      "field": "effective_date",
      "quote": "Hợp đồng có hiệu lực kể từ ngày 01 tháng 06 năm 2026.",
      "section": "ĐIỀU 3: THỜI HẠN HỢP ĐỒNG"
    },
    {
      "field": "expiry_date",
      "quote": "Hợp đồng có thời hạn 24 tháng, hết hạn vào ngày 31 tháng 05 năm 2028.",
      "section": "ĐIỀU 3: THỜI HẠN HỢP ĐỒNG"
    },
    {
      "field": "contract_value",
      "quote": "Giá trị hợp đồng: 4.800.000.000 VNĐ/năm (Bốn tỷ tám trăm triệu đồng/năm).",
      "section": "ĐIỀU 4: GIÁ TRỊ VÀ THANH TOÁN"
    },
    {
      "field": "payment_terms",
      "quote": "Thanh toán hàng tháng: 400.000.000 VNĐ. Thanh toán trong vòng 15 ngày kể từ ngày nhận hóa đơn.",
      "section": "ĐIỀU 4: GIÁ TRỊ VÀ THANH TOÁN"
    },
    {
      "field": "scope",
      "quote": "Bên B cung cấp cho Bên A dịch vụ thuê kênh truyền dẫn quốc tế với thông số kỹ thuật:\n- Băng thông: 10 Gbps STM-64\n- Tuyến: Hồ Chí Minh — Singapore (qua cáp quang biển APG)",
      "section": "ĐIỀU 1: ĐỐI TƯỢNG HỢP ĐỒNG"
    },
    {
      "field": "sla",
      "quote": "Thời gian sẵn sàng — Uptime SLA:\n- Mục tiêu: 99.99% (tối đa 52.56 phút ngừng dịch vụ/năm)",
      "section": "ĐIỀU 2: CAM KẾT MỨC DỊCH VỤ (SLA)"
    },
    {
      "field": "penalty_clause",
      "quote": "Nếu Bên B không đạt SLA uptime 99.99% trong một tháng:\n- Phạt 0.1% giá trị hợp đồng hàng tháng cho mỗi phút ngừng dịch vụ vượt quá mức cho phép.\n- Mức cho phép: 4.38 phút/tháng (= 52.56 phút/năm ÷ 12).\n- Tối đa phạt không quá 25% giá trị hợp đồng hàng tháng.\nNếu Bên B không khôi phục sự cố trong RTO 4 giờ:\n- Phạt thêm 50.000.000 VNĐ cho mỗi giờ vượt RTO.\n- Không giới hạn mức phạt RTO.",
      "section": "ĐIỀU 5: ĐIỀU KHOẢN PHẠT"
    },
    {
      "field": "auto_renewal",
      "quote": "Tự động gia hạn thêm 12 tháng trừ khi một bên thông báo bằng văn bản trước 90 ngày.",
      "section": "ĐIỀU 3: THỜI HẠN HỢP ĐỒNG"
    },
    {
      "field": "confidentiality",
      "quote": "Cả hai bên cam kết bảo mật:\n- Dữ liệu lưu lượng truyền dẫn, thông tin khách hàng, cấu hình kỹ thuật.\n- Báo cáo hiệu suất và SLA không được chia sẻ cho bên thứ ba mà không có đồng ý bằng văn bản.\n- Nghĩa vụ bảo mật kéo dài 3 năm sau khi hợp đồng hết hạn.",
      "section": "ĐIỀU 7: BẢO MẬT THÔNG TIN"
    },
    {
      "field": "liability_cap",
      "quote": "Tổng trách nhiệm bồi thường của Bên B không vượt quá giá trị hợp đồng của 03 tháng.",
      "section": "ĐIỀU 8: BẢO HIỂM VÀ BỒI THƯỜNG"
    },
    {
      "field": "dispute_resolution",
      "quote": "Mọi tranh chấp phát sinh sẽ được giải quyết qua thương lượng trong 30 ngày. Nếu không đạt, tranh chấp sẽ được đưa ra Trọng tài thương mại TP. HCM.",
      "section": "ĐIỀU 9: GIẢI QUYẾT TRANH CHẤP"
    }
  ],
  "confidence": 0.75,
  "needs_human_review": true,
  "red_flags": [
    "Phạt không giới hạn: không có mức tối đa cho phạt vi phạm RTO (50.000.000 VNĐ/giờ)",
    "Giới hạn trách nhiệm quá thấp: chỉ bằng 3 tháng giá trị hợp đồng (25% giá trị hợp đồng năm)",
    "Điều khoản bất lợi ẩn: phạt vi phạm RTO không giới hạn có thể dễ dàng vượt quá giới hạn trách nhiệm bồi thường (1.200.000.000 VNĐ)"
  ],
  "missing_fields": [],
  "extraction_notes": "Tài liệu được trích xuất đầy đủ và chính xác từ văn bản gốc. Phát hiện các điều khoản phạt vi phạm RTO không giới hạn và giới hạn trách nhiệm thấp có lợi cho Bên B, cần chuyển sang HITL."
}
