{
  "contract_id": "contract-003-risky",
  "effective_date": "2026-03-01",
  "expiry_date": "2027-02-28",
  "penalty_clause": "Phạt 5% giá trị hợp đồng hàng tháng cho mỗi giờ vượt, không giới hạn mức phạt",
  "penalty_amount": "5% giá trị hợp đồng hàng tháng cho mỗi giờ",
  "source_evidence": [
    {
      "field": "effective_date",
      "quote": "01 tháng 03 năm 2026",
      "section": "Điều 2"
    },
    {
      "field": "penalty_clause",
      "quote": "Không giới hạn mức phạt tối đa",
      "section": "Điều 4"
    },
    {
      "field": "red_flag_auto_renew",
      "quote": "tự động gia hạn thêm 12 tháng...chấm dứt trước 15 ngày",
      "section": "Điều 2"
    }
  ],
  "confidence": 0.65,
  "needs_human_review": true,
  "red_flags": [
    "Tự gia hạn bất lợi: chỉ cần thông báo 15 ngày trước",
    "Phạt không giới hạn: không có mức tối đa",
    "Giới hạn trách nhiệm quá thấp: chỉ bằng 1 tháng giá trị",
    "Mâu thuẫn giữa điều khoản chấm dứt và tự gia hạn"
  ],
  "missing_fields": [],
  "extraction_notes": "Phát hiện 3+ cờ đỏ. Confidence thấp."
}